{
  "$schema": "http://json-schema.org/draft-07/schema#",
  "$id": "https://xlb.local/schemas/tke/release-manifest.schema.json",
  "title": "XLB TKE release manifest",
  "type": "object",
  "additionalProperties": false,
  "required": [
    "schemaVersion",
    "releaseId",
    "environment",
    "executionMode",
    "sourceCommit",
    "createdAt",
    "owners",
    "changeWindow",
    "imageLockFile",
    "cloudBundleFile",
    "evidenceFile",
    "checkpointFile",
    "trafficProvider"
  ],
  "properties": {
    "schemaVersion": { "const": 1 },
    "releaseId": {
      "type": "string",
      "minLength": 6,
      "maxLength": 63,
      "pattern": "^[a-z0-9](?:[a-z0-9.-]*[a-z0-9])$"
    },
    "environment": { "enum": ["staging", "production"] },
    "executionMode": { "const": "gated-release" },
    "sourceCommit": { "type": "string", "pattern": "^[a-f0-9]{40}$" },
    "createdAt": { "$ref": "#/definitions/timestamp" },
    "owners": {
      "type": "object",
      "additionalProperties": false,
      "required": ["release", "data", "onCall", "cost"],
      "properties": {
        "release": { "$ref": "#/definitions/nonEmpty" },
        "data": { "$ref": "#/definitions/nonEmpty" },
        "onCall": { "$ref": "#/definitions/nonEmpty" },
        "cost": { "$ref": "#/definitions/nonEmpty" }
      }
    },
    "changeWindow": {
      "type": "object",
      "additionalProperties": false,
      "required": ["startsAt", "endsAt", "timezone"],
      "properties": {
        "startsAt": { "$ref": "#/definitions/timestamp" },
        "endsAt": { "$ref": "#/definitions/timestamp" },
        "timezone": { "const": "Asia/Shanghai" }
      }
    },
    "imageLockFile": { "$ref": "#/definitions/artifactJsonPath" },
    "cloudBundleFile": { "$ref": "#/definitions/artifactJsonPath" },
    "evidenceFile": { "$ref": "#/definitions/artifactJsonPath" },
    "checkpointFile": { "$ref": "#/definitions/artifactJsonPath" },
    "trafficProvider": { "enum": ["clb", "dns"] }
  },
  "definitions": {
    "nonEmpty": { "type": "string", "minLength": 1, "maxLength": 160 },
    "timestamp": {
      "type": "string",
      "pattern": "^\\d{4}-\\d{2}-\\d{2}T\\d{2}:\\d{2}:\\d{2}(?:\\.\\d{3})?Z$"
    },
    "artifactJsonPath": {
      "type": "string",
      "pattern": "^\\.artifacts/tke/[a-z0-9./-]+\\.json$"
    }
  }
}
