{
  "schemaVersion": 1,
  "releaseId": "release-20260716-001",
  "environment": "production",
  "executionMode": "gated-release",
  "sourceCommit": "aaaaaaaaaaaaaaaaaaaaaaaaaaaaaaaaaaaaaaaa",
  "createdAt": "2026-07-16T08:00:00Z",
  "owners": {
    "release": "release-owner",
    "data": "data-owner",
    "onCall": "oncall-owner",
    "cost": "cost-owner"
  },
  "changeWindow": {
    "startsAt": "2026-07-18T01:00:00Z",
    "endsAt": "2026-07-18T05:00:00Z",
    "timezone": "Asia/Shanghai"
  },
  "imageLockFile": ".artifacts/tke/releases/release-20260716-001/images.lock.json",
  "cloudBundleFile": ".artifacts/tke/production/cloud-bundle.json",
  "evidenceFile": ".artifacts/tke/releases/release-20260716-001/evidence.json",
  "checkpointFile": ".artifacts/tke/releases/release-20260716-001/checkpoint.json",
  "trafficProvider": "clb"
}
